<?xml version = "1.0" encoding = "UTF-8" standalone = "yes" ?>
<country xmlns:xsi="http://www.w3.org/2001/XMLSchema-instance" xsi:noNamespaceSchemaLocation="country.xsd"
    name="Sweden">
     <economics-data>
		 <GDP value="585,939"/>
		 <PPP value="677,230"/>
		 <population value=".010,549,347"/>
		 <GDP-growth value="2.64"/>
	</economics-data>
			<!-- Taken from https://www.worlddata.info/average-bodyheight.php -->
    <characteristics average-male-height="180" average-female-height="167"
	            average-male-weight="87.1" average-female-weight="70.5"/>
    <first-name-list>

        <first-name value="William" gender="male" />
        <first-name value="Lucas" gender="male" />
        <first-name value="Liam" gender="male" />
        <first-name value="Oscar" gender="male" />
        <first-name value="Elias" gender="male" />
        <first-name value="Hugo" gender="male" />
        <first-name value="Oliver" gender="male" />
        <first-name value="Charlie" gender="male" />
        <first-name value="Axel" gender="male" />
        <first-name value="Vincent" gender="male" />

        <first-name value="Elsa" gender="female" />
        <first-name value="Alice" gender="female" />
        <first-name value="Maja" gender="female" />
        <first-name value="Saga" gender="female" />
        <first-name value="Ella" gender="female" />
        <first-name value="Lily" gender="female" />
        <first-name value="Olivia" gender="female" />
        <first-name value="Ebba" gender="female" />
        <first-name value="Wilma" gender="female" />
        <first-name value="Julia" gender="female" />
    </first-name-list>
    <last-name-list>
        <!-- 10 most common Swedish surnames -->

        <last-name value="Andersson" />
        <last-name value="Eriksson" />
        <last-name value="Gustafsson" />
        <last-name value="Johansson" />
        <last-name value="Karlsson" />
        <last-name value="Larsson" />
        <last-name value="Nilsson" />
        <last-name value="Olsson" />
        <last-name value="Persson" />
        <last-name value="Svensson" />

    </last-name-list>
</country>